{
  "target": "/mnt/windows",
  "device": "/dev/sda2",
  "timestamp": "2008-11-20T01:09:04.621055+00:00",
  "verdict": "OK",
  "dirty_bit": {
    "method": "ntfsfix",
    "dirty": null,
    "error": null,
    "note": "Refusing to operate on read-write mounted device /dev/sda2."
  },
  "events": {
    "system_evtx_available": true,
    "app_evtx_available": true,
    "disk_errors": [],
    "chkdsk_entries": [],
    "disk_error_counts": {},
    "total_disk_errors": 0,
    "total_chkdsk_runs": 0
  }
}